[
  {"id":"athenas_shield","name":"Athena's Shield","category":"Defense","cost":null,"sourceRefs":[{"label":"Liquipedia equipment page","url":"https://liquipedia.net/mobilelegends/Athena's_Shield","verifiedOn":"2026-03-25"}],"statsGranted":{"HP":900,"HP Regen":2,"Magic Defense":48},"passiveEffects":[{"name":"Shielding","description":"Taking magic damage grants a temporary magic damage reduction window after a short cooldown.","tags":["Anti-Burst","Magic Defense","Durability"]}],"activeEffects":[],"goodAgainstTags":["Burst","Poke","AoE"],"typicalBuilders":{"roles":["Tank","Fighter","Support"],"heroTags":["Frontline","Peel","Anti-Dive"]},"situationalUsageTags":["Anti-Burst","Magic Defense","Durability"]},
  {"id":"dominance_ice","name":"Dominance Ice","category":"Defense","cost":null,"sourceRefs":[{"label":"Liquipedia equipment page","url":"https://liquipedia.net/mobilelegends/Dominance_Ice","verifiedOn":"2026-03-25"}],"statsGranted":{"Mana":500,"Physical Defense":55,"Movement Speed":"5%"},"passiveEffects":[{"name":"Arctic Cold","description":"Enemies that hit the wearer lose attack speed and feel weaker in extended trades.","tags":["Anti-Dive","Physical Defense","Attack Speed"]},{"name":"Lifebane","description":"Enemies around the wearer suffer reduced healing and shield value.","tags":["Anti-Heal","Durability"]}],"activeEffects":[],"goodAgainstTags":["Sustain","Sustained DPS","Mobility","Frontline"],"typicalBuilders":{"roles":["Tank","Fighter","Support"],"heroTags":["Frontline","Engage","Anti-Dive"]},"situationalUsageTags":["Anti-Heal","Physical Defense","Mana","Durability","Anti-Dive"]},
  {"id":"sea_halberd","name":"Sea Halberd","category":"Attack","cost":null,"sourceRefs":[{"label":"Liquipedia equipment page","url":"https://liquipedia.net/mobilelegends/Sea_Halberd","verifiedOn":"2026-03-25"}],"statsGranted":{"Physical Attack":80,"Attack Speed":"20%"},"passiveEffects":[{"name":"Lifebane","description":"Basic attacks and skills inflict healing reduction on the target.","tags":["Anti-Heal","Attack Speed"]},{"name":"Punish the Big Target","description":"Deals better follow-up value into high-HP or high-sustain targets.","tags":["Anti-Tank","DPS Boost"]}],"activeEffects":[],"goodAgainstTags":["Sustain","Frontline","Late Game"],"typicalBuilders":{"roles":["Marksman","Fighter","Assassin"],"heroTags":["Sustained DPS","Burst","Backline Carry"]},"situationalUsageTags":["Anti-Heal","Anti-Tank","Attack Speed","DPS Boost"]},
  {"id":"divine_glaive","name":"Divine Glaive","category":"Magic","cost":null,"sourceRefs":[{"label":"Liquipedia equipment page","url":"https://liquipedia.net/mobilelegends/Divine_Glaive","verifiedOn":"2026-03-25"}],"statsGranted":{"Magic Power":60,"Magic Penetration":"35%"},"passiveEffects":[{"name":"Spellbreaker","description":"Gains more effective penetration when enemies stack magic defense.","tags":["Penetration","Anti-Tank"]}],"activeEffects":[],"goodAgainstTags":["Frontline","Sustain","Late Game"],"typicalBuilders":{"roles":["Mage","Support"],"heroTags":["Burst","Poke","Backline Carry"]},"situationalUsageTags":["Penetration","Anti-Tank","Poke Support"]},
  {"id":"wind_of_nature","name":"Wind of Nature","category":"Attack","cost":null,"sourceRefs":[{"label":"Liquipedia equipment page","url":"https://liquipedia.net/mobilelegends/Wind_of_Nature","verifiedOn":"2026-03-25"}],"statsGranted":{"Physical Attack":30,"Attack Speed":"20%","Lifesteal":"10%"},"passiveEffects":[{"name":"Protective Burst","description":"Adds offensive stats while keeping marksmen alive longer against physical dive.","tags":["Anti-Burst","Attack Speed","Sustain"]}],"activeEffects":["Temporarily becomes immune to physical damage, mainly for marksman self-defense."],"goodAgainstTags":["Burst","Ambush","Pickoff"],"typicalBuilders":{"roles":["Marksman","Assassin"],"heroTags":["Backline Carry","Sustained DPS","Mobility"]},"situationalUsageTags":["Anti-Burst","Attack Speed","Sustain"]}
]
